{"schema_version": 1, "state_revision": 5, "active_task_id": "TASK-0001", "active_stage_id": "STAGE-0001", "active_work_order_id": "WORK-0001", "latest_checkpoint_id": "CHECKPOINT-0003", "latest_handoff_id": null, "latest_context_id": "CTX-0001", "active_review_pack_id": null, "latest_transfer_id": null, "task_final_review_pack_id": null, "active_task_branch": "continuity/TASK-0001-foundation", "updated_at": "2026-07-17T15:00:00+08:00"}
